{
  "blockers": [],
  "changeId": "internalize-frontend-stack-tool-routing",
  "evidence": [
    "openspec/changes/internalize-frontend-stack-tool-routing/frontend-stack-decision.json",
    "openspec/changes/internalize-frontend-stack-tool-routing/capability-inventory.json",
    "openspec/changes/internalize-frontend-stack-tool-routing/component-route.json",
    "openspec/changes/internalize-frontend-stack-tool-routing/direction-preview.json",
    "openspec/changes/internalize-frontend-stack-tool-routing/design-system-decision.json",
    "tests/frontend-stack-routing.test.cjs",
    "qa:371/371",
    "package:reproducible",
    "installed-cli-smoke:9/9",
    "openspec/changes/internalize-frontend-stack-tool-routing/qa.md"
  ],
  "extensions": {},
  "foundations": {
    "design": {
      "path": "DESIGN.md",
      "sha256": "1126499915fb720ce0943afcba8b9327885c11a6ccc63160db96cd801a8cf88e",
      "status": "ready",
      "validator": "designer-pipeline foundation check --kind design"
    },
    "motion": {
      "path": "MOTION.md",
      "sha256": "5a23e0fcdb7d4ebddea2f8f446b91edbdaba3812baf44a7066034b5b2d8e7302",
      "status": "ready",
      "validator": "designer-pipeline foundation check --kind motion"
    }
  },
  "lastEventSeq": 9,
  "migration": null,
  "nextActions": [],
  "phase": "release-readiness",
  "registryVersion": "design-pipeline.phases.v2",
  "revision": 9,
  "sceneRuntime": null,
  "schema": "design-pipeline.state.v2",
  "status": "verifying",
  "updatedAt": "2026-08-13T04:13:54.783Z"
}
