{
  "blockers": [],
  "changeId": "add-design-skill-layer",
  "evidence": [
    "change-a:archive/2026-08-23-decouple-component-first-gate/handoff.md",
    "change-b:design-component-first-artifact-v2/handoff.md",
    "design-skill-core.cjs",
    "design-skill-manifest.schema.json",
    "design-promotion-handoff.schema.json",
    "tests/design-skill-layer.test.cjs",
    "focused-tests:9-pass",
    "tests:561-pass",
    "package-qa:passed"
  ],
  "extensions": {},
  "foundations": {
    "design": null,
    "motion": null
  },
  "lastEventSeq": 5,
  "migration": null,
  "nextActions": [],
  "phase": "release-readiness",
  "registryVersion": "design-pipeline.phases.v2",
  "revision": 5,
  "sceneRuntime": null,
  "schema": "design-pipeline.state.v2",
  "status": "complete",
  "updatedAt": "2026-08-26T20:30:00.000Z"
}
