{
  "blockers": [],
  "changeId": "design-component-first-artifact-v2",
  "evidence": [],
  "extensions": {},
  "foundations": {
    "design": null,
    "motion": null
  },
  "lastEventSeq": 0,
  "migration": null,
  "nextActions": [
    "schedule-artifact-v2-implementation"
  ],
  "phase": "brief",
  "registryVersion": "design-pipeline.phases.v2",
  "revision": 0,
  "sceneRuntime": null,
  "schema": "design-pipeline.state.v2",
  "status": "initialized",
  "updatedAt": "2026-08-15T04:00:00.000Z"
}
