{
  "blockers": [],
  "changeId": "design-component-first-artifact-v2",
  "evidence": [
    "change-a:archive/2026-08-23-decouple-component-first-gate/handoff.md",
    "component-first-v2-core.cjs",
    "component-first-artifact-v2.schema.json",
    "tests/component-first-v2.test.cjs",
    "focused-tests:9-pass",
    "tests:561-pass",
    "package-qa:passed"
  ],
  "extensions": {},
  "foundations": {
    "design": null,
    "motion": null
  },
  "lastEventSeq": 5,
  "migration": null,
  "nextActions": [],
  "phase": "release-readiness",
  "registryVersion": "design-pipeline.phases.v2",
  "revision": 5,
  "sceneRuntime": null,
  "schema": "design-pipeline.state.v2",
  "status": "complete",
  "updatedAt": "2026-08-26T20:30:00.000Z"
}
